{
  "$schema": "https://json-schema.org/draft/2020-12/schema",
  "title": "Standing Charter",
  "description": "A human-written standing authorization for a role to initiate a commission on a cadence or event. A charter can start work; it can never widen what any role may execute. It is the calendar half of a standing approval.",
  "type": "object",
  "additionalProperties": false,
  "required": ["version", "id", "owner_role", "trigger", "commission", "departments", "dominant_outcome", "bounds", "approved_by", "expires"],
  "properties": {
    "version": {"type": "integer", "const": 1},
    "id": {"type": "string", "pattern": "^[a-z0-9][a-z0-9._-]*$"},
    "title": {"type": "string"},
    "owner_role": {"type": "string", "pattern": "^[a-z-]+$", "description": "The role that initiates: chief-of-staff (company-wide) or a department index role such as marketing (a 'marketing director' charter)."},
    "trigger": {
      "type": "object", "additionalProperties": false,
      "oneOf": [{"required": ["cron"]}, {"required": ["event"]}],
      "properties": {
        "cron": {"type": "string", "pattern": "^([0-9*,/-]+\\s+){4}[0-9A-Za-z*,/-]+$"},
        "timezone": {"type": "string"},
        "event": {"type": "string", "pattern": "^[a-z0-9_-]+(\\.[a-z0-9_-]+)+$", "description": "Dotted event name, e.g. yalloha.review.created. The private runner maps it to a webhook or poll."}
      }
    },
    "commission": {"type": "string", "minLength": 10, "description": "The objective handed to the Chief of Staff, verbatim."},
    "departments": {"type": "array", "minItems": 1, "uniqueItems": true, "items": {"enum": ["sales", "marketing", "service", "operations", "legal", "finance", "product", "strategy"]}},
    "dominant_outcome": {"enum": ["commercial-opportunity", "demand-generation", "customer-resolution", "internal-operations", "legal-obligation", "financial-control", "product-capability", "strategic-direction", "cross-functional"]},
    "risk": {"enum": ["low", "moderate", "high"], "default": "moderate"},
    "bounds": {
      "type": "object", "additionalProperties": false, "required": ["max_external_actions"],
      "properties": {
        "max_external_actions": {"type": "integer", "minimum": 0, "description": "Cap on external tool calls in one run. 0 means draft-only runs."},
        "max_runtime_minutes": {"type": "integer", "minimum": 1},
        "standing_approvals": {"type": "array", "uniqueItems": true, "items": {"type": "string", "pattern": "^mcp__[a-z0-9_-]+__[a-z0-9_]+$"},
                               "description": "Standing approvals this charter may rely on. Each must exist as a human-written file at run time; the charter cannot create them."},
        "notify": {"type": "string", "description": "Where the run summary goes (ref, not a secret)."},
        "max_budget_usd": {"type": "number", "exclusiveMinimum": 0, "description": "Dollar cap (estimated model spend) on one headless session under the SDK runtime; the session stops when it is reached. Default 5."},
        "read_tools": {"type": "array", "uniqueItems": true, "items": {"type": "string", "pattern": "^mcp__[a-z0-9_-]+__([a-z0-9_]+|\\*)$"}, "description": "MCP tools of servers with no published connector that this charter declares read-only (exact names or mcp__<server>__*). Each server must be a system declared write_authority none. The SDK runtime denies any other undescribed MCP tool."}
      }
    },
    "approved_by": {"type": "string", "minLength": 1},
    "expires": {"type": "string", "pattern": "^\\d{4}-\\d{2}-\\d{2}$"},
    "notes": {"type": "string"}
  }
}
